{
  "case_id": "COIN-FY24",
  "model_id": "deepseek-v4-flash-vision-exp",
  "prompt_version": "PV016",
  "risks": [
    {
      "risk_id": "R1",
      "risk_summary": "Decline in crypto asset prices or trading demand could adversely affect business and stock price.",
      "risk_type": "Strategic / Market / Technology",
      "evidence_quote": "In the event that the price of crypto assets or the demand for trading crypto assets decline, our business, operating results, and financial condition would be adversely affected",
      "reasoning": "Not separately analyzed in the core extraction task.",
      "financial_impact": "Not separately analyzed in the core extraction task.",
      "time_horizon": "Not separately analyzed in the core extraction task.",
      "mitigation": "Not separately analyzed in the core extraction task.",
      "uncertainty": "Not separately analyzed in the core extraction task.",
      "source_paragraph_ids": [
        "COIN-FY24-P002"
      ],
      "source_pages": [
        25
      ],
      "monitoring_indicators": []
    },
    {
      "risk_id": "R2",
      "risk_summary": "Reliance on third-party partners like Circle for USDC services could harm operations if they fail.",
      "risk_type": "Operational / Supply Chain",
      "evidence_quote": "If Circle fails to provide certain operational services, our ability to maintain our current level of offerings and customer experience for USDC could be harmed",
      "reasoning": "Not separately analyzed in the core extraction task.",
      "financial_impact": "Not separately analyzed in the core extraction task.",
      "time_horizon": "Not separately analyzed in the core extraction task.",
      "mitigation": "Not separately analyzed in the core extraction task.",
      "uncertainty": "Not separately analyzed in the core extraction task.",
      "source_paragraph_ids": [
        "COIN-FY24-P009"
      ],
      "source_pages": [
        26
      ],
      "monitoring_indicators": []
    },
    {
      "risk_id": "R3",
      "risk_summary": "Cyberattacks and security breaches could harm reputation, operations, and financial condition.",
      "risk_type": "Cybersecurity / Data / Privacy",
      "evidence_quote": "Cyberattacks and security breaches of our platform, or those impacting our customers or third parties, could adversely affect our brand, reputation, business, operating results, and financial condition.",
      "reasoning": "Not separately analyzed in the core extraction task.",
      "financial_impact": "Not separately analyzed in the core extraction task.",
      "time_horizon": "Not separately analyzed in the core extraction task.",
      "mitigation": "Not separately analyzed in the core extraction task.",
      "uncertainty": "Not separately analyzed in the core extraction task.",
      "source_paragraph_ids": [
        "COIN-FY24-P012"
      ],
      "source_pages": [
        28
      ],
      "monitoring_indicators": []
    }
  ]
}
